"id","name","status","funded_amount","activity","sector","use","partner_id","posted_date","planned_expiration_date","loan_amount","borrower_count","lender_count","bonus_credit_eligibility","tags","themes","description.languages","image.id","image.template_id","location.country_code","location.country","location.town","location.geo.level","location.geo.pairs","location.geo.type"
1099774,"Lorna","funded",300,"Pigs","Agriculture","to buy feeds, vitamins, and other supplies to raise her livestock.",145,"2016-06-20T14:50:04Z","2016-07-20T14:50:04Z",300,1,10,TRUE,"#Animals",NA,"en",2228028,1,"PH","Philippines","Sogod Cebu","town","13 122","point"
1099465,"Besan","funded",3000,"Poultry","Agriculture","to buy poultry per customer requests, cages and food for them,.",80,"2016-06-20T14:50:02Z","2016-07-20T14:50:02Z",3000,1,108,FALSE,"#Animals","Youth, Arab Youth","en",2227239,1,"PS","Palestine","Ramallah City, West Bank","town","31.92157 35.203285","point"
1099766,"Airyn","funded",225,"General Store","Retail","To purchase additional stocks for her general store.",136,"2016-06-20T14:50:02Z","2016-07-20T14:50:02Z",225,1,3,TRUE,"#Woman Owned Biz, #Parent",NA,"en",2228010,1,"PH","Philippines","miputak,dipolog city","town","13 122","point"
1099771,"Parveen","funded",300,"Fruits & Vegetables","Food","to increase her son's vegetable business.",247,"2016-06-20T14:40:06Z","2016-07-20T14:40:06Z",300,1,12,FALSE,"#Elderly","Underfunded Areas","en",2228021,1,"PK","Pakistan","Rawalpindi","town","30 70","point"
1099784,"Ma. Azelle","funded",225,"Personal Housing Expenses","Housing","to build a sanitary toilet for her family.",145,"2016-06-20T14:40:06Z","2016-07-20T14:40:05Z",225,1,9,TRUE,"user_favorite","Green","en",2228038,1,"PH","Philippines","Isabela, Negros Occidental","town","13 122","point"
1099786,"Marllyn","funded",175,"General Store","Retail","to buy items to sell like canned goods, eggs, home product care, and other groceries.",145,"2016-06-20T14:40:06Z","2016-07-20T14:40:06Z",175,1,3,TRUE,"#Elderly",NA,"es, en",2228041,1,"PH","Philippines","Sogod Leyte","town","13 122","point"
1100368,"Gabriela Fernanda","funded",1000,"Clothing Sales","Clothing","to buy pants, jackets and blouses.",188,"2016-06-20T14:40:06Z","2016-07-20T14:40:06Z",1000,1,24,TRUE,"user_favorite","Vulnerable Groups, Underfunded Areas","es, en",2228968,1,"EC","Ecuador","Tulcán","town","-2 -77.5","point"
1101574,"Nelson Eduardo","funded",800,"Personal Medical Expenses","Health","to pay for skin treatment.",357,"2016-06-20T14:40:06Z","2016-07-20T14:40:06Z",800,1,30,FALSE,"user_favorite, #Single, #Health and Sanitation, #Supporting Family",NA,"en",2231063,1,"MX","Mexico","Monterrey","town","25.666667 -100.316667","point"
1099769,"Evelyn","funded",250,"General Store","Retail","to buy additional items to sell like beverages, canned goods, junk foods, home product care, and other groceries.",145,"2016-06-20T14:40:05Z","2016-07-20T14:40:04Z",250,1,1,TRUE,NA,NA,"en",2228017,1,"PH","Philippines","Liloan, Cebu","town","13 122","point"
1099772,"Rhea","funded",250,"General Store","Retail","to buy additional items to sell like beverages, canned goods, eggs, home product care, and other groceries.",145,"2016-06-20T14:40:05Z","2016-07-20T14:40:05Z",250,1,7,TRUE,"#Repeat Borrower",NA,"en",1890445,1,"PH","Philippines","Sogod Cebu","town","13 122","point"
1099783,"Ma. Elvira","funded",200,"General Store","Retail","to buy additional items to sell like beverages, canned goods, junk foods, home product care, and other groceries.",145,"2016-06-20T14:40:05Z","2016-07-20T14:40:05Z",200,1,7,TRUE,NA,NA,"en",2228037,1,"PH","Philippines","Sogod Leyte","town","13 122","point"
1099763,"Evelyn","funded",275,"Food","Food","to buy ingredients, such as, flour, sugar and other supplies needed in her business.",145,"2016-06-20T14:40:04Z","2016-07-20T14:40:04Z",275,1,8,TRUE,"#Elderly",NA,"en",2228009,1,"PH","Philippines","Liloan, Cebu","town","13 122","point"
1099765,"Rosario","funded",325,"General Store","Retail","to buy additional stocks to sell milk, soap, egg, chips, noodles, etc.",145,"2016-06-20T14:40:04Z","2016-07-20T14:40:04Z",325,1,5,TRUE,"#Woman Owned Biz, #Parent",NA,"en",2228011,1,"PH","Philippines","Cauayan, Negros Occidental","town","13 122","point"
1099767,"Fely","funded",175,"Fish Selling","Food","to buy variety of fish and other supplies needed in her business.",145,"2016-06-20T14:40:04Z","2016-07-20T14:40:04Z",175,1,7,TRUE,"user_favorite",NA,"en",2228014,1,"PH","Philippines","Liloan, Cebu","town","13 122","point"
1099785,"Raulene","funded",175,"Food","Food","purchase raw ingredients needed to make food products for sale and grocery items.",136,"2016-06-20T14:40:02Z","2016-07-20T14:40:02Z",175,1,7,TRUE,NA,NA,"es, en",2228035,1,"PH","Philippines","Tabuan,  Tukuran Zamboanga Del Sur","town","13 122","point"
1101636,"Mujeres Valientes Group","funded",3450,"Beauty Salon","Services","purchase hair coloring, creams, shampoo, rinses and other beauty salon products.",58,"2016-06-20T14:40:02Z","2016-07-20T14:40:01Z",3450,20,67,TRUE,"user_favorite, #First Loan",NA,"en",2231132,1,"PY","Paraguay","Santaní","town","-22.993333 -57.996389","point"
1099476,"Soma And Group","funded",2050,"Cereals","Food","to purchase more stock for the expansion of her paddy and rice business.",428,"2016-06-20T14:30:06Z","2016-07-20T14:30:05Z",2050,10,22,FALSE,"user_favorite, #Woman Owned Biz, #Vegan","Green, Underfunded Areas, Green, Rural Exclusion","en",2227355,1,"IN","India","Srirampur","town","20 77","point"
1099762,"Rosana","funded",325,"General Store","Retail","to purchase canned goods, milk, bread, chips, eggs, noodles, spices, sugar, etc.",145,"2016-06-20T14:30:05Z","2016-07-20T14:30:05Z",325,1,12,TRUE,NA,NA,"en",2228005,1,"PH","Philippines","Cauayan, Negros Occidental","town","13 122","point"
1101572,"Antonio","expired",425,"Personal Medical Expenses","Health","to pay for his mother-in-law to recover her sight.",357,"2016-06-20T14:30:05Z","2016-07-20T14:30:05Z",675,1,15,FALSE,"#Parent, #Health and Sanitation, #Supporting Family",NA,"en",2230101,1,"MX","Mexico","Monterrey","town","25.666667 -100.316667","point"
1099755,"Joesel","funded",450,"Transportation","Transportation","to pay for repairs, repainting and the purchase of spare parts.",136,"2016-06-20T14:30:02Z","2016-07-20T14:30:02Z",450,1,16,TRUE,"user_favorite, #Parent, #Repeat Borrower, #Repair Renew Replace",NA,"es, en",1957826,1,"PH","Philippines","Pan-ay Diot, Clarin Misamis Occidental","town","13 122","point"
