"id","name","status","funded_amount","activity","sector","use","partner_id","posted_date","planned_expiration_date","loan_amount","borrower_count","lender_count","bonus_credit_eligibility","tags","themes","description.languages","image.id","image.template_id","location.country_code","location.country","location.town","location.geo.level","location.geo.pairs","location.geo.type"
1052337,"Alejandra","funded",675,"Spare Parts","Retail","to have supporting funds for her business of buying and selling car spare parts.",144,"2016-04-14T14:40:03Z","2016-05-14T14:40:03Z",675,1,19,TRUE,"#Eco-friendly, #Supporting Family",NA,"en",2146471,1,"PH","Philippines","Pasay City","town","13 122","point"
1052340,"Remedios","funded",1100,"Sewing","Services","to buy necessary materials on a daily basis to produce a greater number of rugs, and to stock grocery items for her variety store.",144,"2016-04-14T14:40:03Z","2016-05-14T14:40:03Z",1100,1,36,TRUE,"#Woman Owned Biz, #Parent, #Repeat Borrower",NA,"en",2146472,1,"PH","Philippines","Pasay City","town","13 122","point"
1051748,"Sandra Elizabeth","funded",1000,"Retail","Retail","buy clothing, footwear, perfume etc.",137,"2016-04-14T14:40:02Z","2016-05-14T14:40:02Z",1000,1,17,TRUE,"user_favorite, #Woman Owned Biz, #Parent",NA,"en",2145690,1,"EC","Ecuador","Manta","town","-2 -77.5","point"
1051752,"Karen Fabiola","funded",900,"Grocery Store","Food","to buy groceries.",137,"2016-04-14T14:40:02Z","2016-05-14T14:40:02Z",900,1,21,TRUE,"user_favorite, #Woman Owned Biz, #Single",NA,"en",2145696,1,"EC","Ecuador","Manta","town","-2 -77.5","point"
1052336,"Im","funded",750,"Farming","Agriculture","to buy fertilizer in order to grow her crops well and fruitfully.",204,"2016-04-14T14:30:03Z","2016-05-14T14:30:03Z",750,1,27,TRUE,"#Woman Owned Biz, #Vegan, #Parent, #Repeat Borrower",NA,"en",2146770,1,"KH","Cambodia","Kampong Cham province, Ponhea Krek district","town","13 105","point"
1051569,"Tatiana Patricia","funded",450,"General Store","Retail","to buy an assortment of crayons, pencils, paints, notepads, cosmetics, and toiletries.",154,"2016-04-14T14:20:03Z","2016-05-14T14:20:03Z",450,1,7,TRUE,"user_favorite, #First Loan, #Woman Owned Biz, #Parent","Innovative Loans, Flexible Credit Study, IPA Study","es, en",2145304,1,"CO","Colombia","Barranquilla","town","4 -72","point"
1051744,"Jackeline","funded",600,"Hardware","Retail","buy cement, sand, paint, hoses, and other items at wholesale prices.",154,"2016-04-14T14:20:03Z","2016-05-14T14:20:03Z",600,1,21,TRUE,"user_favorite, #First Loan, #Parent","Innovative Loans, Flexible Credit Study, IPA Study","es, en",2145684,1,"CO","Colombia","Barranquilla","town","4 -72","point"
1052339,"Paul","funded",700,"Higher education costs","Education","to pay for tuition costs.",386,"2016-04-14T14:20:03Z","2016-05-14T14:20:03Z",700,1,26,FALSE,"#Single, #Schooling",NA,"en",2146771,1,"KE","Kenya","Thika","town","1 38","point"
1052356,"Noeurn's Group","funded",550,"Farming","Agriculture","to buy fertilizer, pesticide and pay for plowing fees.",204,"2016-04-14T14:10:06Z","2016-05-14T14:10:06Z",550,2,19,TRUE,"#Woman Owned Biz, #Vegan, #Elderly, #Parent, #Repeat Borrower",NA,"en",2146794,1,"KH","Cambodia","Tbaung Khmum Province, Ponhea Krek district","town","13 105","point"
1051598,"Catalina","funded",275,"Farming","Agriculture","buy cuttings, fertilizer, and agricultural supplies for her fields.",177,"2016-04-14T14:10:05Z","2016-05-14T14:10:05Z",275,1,9,TRUE,NA,"Rural Exclusion","en",2145365,1,"CO","Colombia","El Carmen de Viboral","town","4 -72","point"
1052353,"Gina","funded",225,"Pigs","Agriculture","to buy feeds, vitamins, and other supplies to raise her livestock.",145,"2016-04-14T14:10:05Z","2016-05-14T14:10:04Z",225,1,6,TRUE,"#Animals",NA,"en",2146788,1,"PH","Philippines","Bogo, Cebu","town","13 122","point"
1052370,"Josephine","funded",350,"Fish Selling","Food","to buy additional boxes of fish to sell and other supplies needed in her business.",145,"2016-04-14T14:10:05Z","2016-05-14T14:10:05Z",350,1,4,TRUE,"#Elderly",NA,"en",2146813,1,"PH","Philippines","Bogo, Cebu","town","13 122","point"
1052352,"Judith","funded",500,"Construction Supplies","Construction","to buy more stock of building stones.",138,"2016-04-14T14:10:03Z","2016-05-14T14:10:02Z",500,1,19,TRUE,"#Woman Owned Biz, #Parent, #Repeat Borrower",NA,"en",2146786,1,"KE","Kenya","Mombasa","town","-4.05 39.666667","point"
1052371,"Saumu","funded",600,"Retail","Retail","to buy more stock of clothes to sell.",138,"2016-04-14T14:10:03Z","2016-05-14T14:10:03Z",600,1,18,TRUE,"user_favorite, #Woman Owned Biz, #Single, #Repeat Borrower",NA,"en",2146815,1,"KE","Kenya","Mombasa","town","-4.05 39.666667","point"
1052369,"Getrude","funded",475,"General Store","Retail","to buy more packets of sugar, rice, boxes of bar soap, cans of paraffin and to increase on the stock of Azam breads to sell.",87,"2016-04-14T14:10:02Z","2016-05-14T14:10:02Z",475,1,16,FALSE,"user_favorite, #Woman Owned Biz, #Parent, #Repeat Borrower",NA,"es, en",2146810,1,"TZ","Tanzania","Dar es Salaam","town","-6.8 39.283333","point"
1052334,"Sokha's Group","funded",2600,"Farming","Agriculture","to buy cassava stems and pay for labor and the plowing fee, which she expects will produce a better yield than before.",204,"2016-04-14T14:00:07Z","2016-05-14T14:00:07Z",2600,5,75,TRUE,"user_favorite, #Woman Owned Biz, #Parent, #Repeat Borrower, #Job Creator",NA,"en",2146769,1,"KH","Cambodia","Battambang province, Phnom Proek district","town","13 105","point"
1052349,"Susan","funded",400,"Farming","Agriculture","to buy seeds, fertilizer, and pesticides.",156,"2016-04-14T14:00:07Z","2016-05-14T14:00:07Z",400,1,11,FALSE,"#Woman Owned Biz, #Parent","Rural Exclusion","en",2146779,1,"KE","Kenya","Nandi Hills","town","1 38","point"
1052368,"Roth's Group","funded",1000,"Farming","Agriculture","to pay for plowing fees in order to grow rice crops.",204,"2016-04-14T14:00:07Z","2016-05-14T14:00:07Z",1000,2,32,TRUE,"#Woman Owned Biz, #Vegan, #Parent, #Repeat Borrower",NA,"en",2146808,1,"KH","Cambodia","Siem Reap Province, Srey Snom district","town","13 105","point"
1051597,"Neder Luis","funded",1150,"Services","Services","to buy copper pipes, adapters, descalers, a leak detector, and welding equipment.",154,"2016-04-14T14:00:06Z","2016-05-14T14:00:06Z",1150,1,42,TRUE,"user_favorite, #First Loan, #Biz Durable Asset","Innovative Loans, Flexible Credit Study, IPA Study","en",2145364,1,"CO","Colombia","Soledad (Atlántico)","town","4 -72","point"
1052351,"Fely","funded",350,"Pigs","Agriculture","tobuy feeds, vitamins, and other supplies to raise her livestock.",145,"2016-04-14T14:00:05Z","2016-05-14T14:00:05Z",350,1,12,TRUE,"#Woman Owned Biz, #Animals, #Elderly, #Parent, #Repeat Borrower",NA,"es, en",2146783,1,"PH","Philippines","Bogo, Cebu","town","13 122","point"
